{
  "name": "m0re Hypnotize",
  "author": "Hypnotize",
  "social": {
    "steam_profile": "76561198058754493",
    "album": "http://imgur.com/a/2gckG"
  },
  "flags": [
    "fonts",
    "menus",
    "scoreboards",
    "crosshairs",
    "minmode",
    "materials",
    "customization"
  ],
  "traits": {
    "os": [
      "windows",
      "linux"
    ],
    "gamemode": [
      "tournament",
      "comp",
      "arena",
      "ad",
      "ctf",
      "cp",
      "halloween",
      "koth",
      "mannpower",
      "mvm",
      "pass",
      "pl",
      "plr",
      "pd",
      "rd",
      "sd",
      "tc"
    ],
    "res": [
      "4/3",
      "5/4",
      "16/9",
      "16/10"
    ],
    "position": [
      "center"
    ],
    "lang": [
      "en"
    ]
  },
  "repo": "https://github.com/Hypnootize/Hypnotize-m0rehud",
  "hash": "0809d6196484f6004bb813768ac9d86326b4af44",
  "parent": "m0rehud",
  "resources": [
    "m0rehypnotize-banner",
    "m0rehypnotize-menu",
    "m0rehypnotize-loadout",
    "m0rehypnotize-backpack",
    "m0rehypnotize-classselection",
    "m0rehypnotize-buff",
    "m0rehypnotize-hurt",
    "m0rehypnotize-minmode",
    "m0rehypnotize-engineer",
    "m0rehypnotize-scoreboard",
    "m0rehypnotize-spectator"
  ]
}
