{
  "name": "HypnotizeHUD",
  "author": "Hypnotize",
  "social": {
    "steam_profile": "76561198058754493",
    "album": "https://imgur.com/a/4sgZ1"
  },
  "flags": [
    "fonts",
    "menus",
    "scoreboards",
    "crosshairs",
    "minmode",
    "streamer-mode",
    "materials",
    "customization"
  ],
  "traits": {
    "os": [
      "windows",
      "linux"
    ],
    "gamemode": [
      "tournament",
      "comp",
      "arena",
      "ad",
      "ctf",
      "cp",
      "halloween",
      "koth",
      "mannpower",
      "mvm",
      "pass",
      "pl",
      "plr",
      "pd",
      "rd",
      "sd",
      "tc"
    ],
    "res": [
      "4/3",
      "5/4",
      "16/9",
      "16/10"
    ],
    "position": [
      "center"
    ],
    "lang": [
      "en"
    ]
  },
  "repo": "https://github.com/Hypnootize/hypnotizehud",
  "hash": "8f61a79d3f03917c48b6a6904d59ea6ecdd8e3f1",
  "resources": [
    "hypnotizehud-banner",
    "hypnotizehud-menu",
    "hypnotizehud-backpack",
    "hypnotizehud-buff",
    "hypnotizehud-low",
    "hypnotizehud-minmode",
    "hypnotizehud-medic",
    "hypnotizehud-scoreboard",
    "hypnotizehud-spectator"
  ]
}
