{
  "name": "SUPERCOMPHUD-OMEGA",
  "author": "lavaOnoes",
  "contributors": ["KACHOWHERO"],
  "flags": [
    "fonts",
    "menus",
    "scoreboards",
    "materials"
  ],
  "repo": "https://github.com/lavaOnoes/SUPERCOMPHUD-OMEGA",
  "hash": "89dc5548d68b4b5426799f0702878e8e9855044b",
  "prerelease": false,
  "resources": [
    "sketch-1700975276009",
    "1",
    "counter"
  ],
  "social": {
    "steam_profile": "76561198850021147",
    "youtube": "@lavaOnoes"
  },
  "traits": {
    "os": [
      "windows",
      "linux"
    ],
    "gamemode": [
      "tournament",
      "comp",
      "arena",
      "ad",
      "ctf",
      "cp",
      "halloween",
      "koth",
      "mannpower",
      "mvm",
      "pass",
      "pl",
      "plr"
    ],
    "res": [
      "4/3",
      "16/10",
      "16/9"
    ]
  }
}
