{
  "name": "ShrekHUD",
  "author": "Hypnotize",
  "social": {
    "steam_profile": "76561198058754493",
    "album": "https://imgur.com/a/i3TpBPa"
  },
  "flags": [
    "fonts",
    "menus",
    "scoreboards",
    "crosshairs",
    "materials"
  ],
  "traits": {
    "os": [
      "windows"
    ],
    "gamemode": [
      "tournament",
      "comp",
      "arena",
      "ad",
      "ctf",
      "cp",
      "halloween",
      "koth",
      "mannpower",
      "mvm",
      "pass",
      "pl",
      "plr",
      "pd",
      "rd",
      "sd",
      "tc"
    ],
    "res": [
      "4/3",
      "5/4",
      "16/9",
      "16/10"
    ]
  },
  "repo": "https://github.com/Hypnootize/ShrekHUD",
  "hash": "3c89fc0b4b2287dfebfa2e89eb573578cd3dd15d",
  "resources": [
    "shrekhud-banner",
    "shrekhud-mm",
    "shrekhud-loadout",
    "shrekhud-backpack",
    "shrekhud-buff",
    "shrekhud-hurt",
    "shrekhud-uber",
    "shrekhud-scoreboard"
  ]
}
