{
  "name": "googHUD",
  "author": "grey",
  "releaseDate": "2023-09-23",
  "flags": [
    "menus",
    "minmode",
    "scoreboards",
    "materials",
    "crosshairs",
    "customization"
  ],
  "tags": [
    "minimal",
    "clean",
    "competitive",
    "comp",
    "beta"
  ],
  "repo": "https://github.com/GreySux/googhud",
  "hash": "f86abc317b03dcaa68d9c87d50822e77473bf604",
  "resources": [
    "googhudpic",
    "googhudmenu",
    "googhud6v6",
    "googhud12v12",
    "googhudmin1",
    "googhudmin0",
    "googhuduber",
    "googhudclasses",
    "googhudtargetid",
    "googhuddamagenums"
  ],
  "social": {
    "support": "https://paypal.me/greysux",
    "steam_profile": "76561198050618142",
    "twitter": "Grey_Sucks",
    "discord": "52D6wACqen",
    "album": "https://imgur.com/a/960Ftgi"
  },
  "traits": {
    "os": [
      "windows"
    ],
    "gamemode": [
      "tournament",
      "comp",
      "arena",
      "ad",
      "ctf",
      "cp",
      "halloween",
      "koth",
      "mannpower",
      "mvm",
      "pass",
      "pl",
      "plr",
      "pd",
      "rd",
      "sd"
    ],
    "res": [
      "16/10",
      "16/9",
      "4/3"
    ],
    "position": [
      "center",
      "corners",
      "default"
    ],
    "lang": [
      "en"
    ]
  }
}
