{
  "name": "HExHUD",
  "author": "Hypnotize",
  "social": {
    "steam_profile": "76561198058754493",
    "album": "https://imgur.com/a/ENQcIqO"
  },
  "flags": [
    "fonts",
    "menus",
    "scoreboards",
    "crosshairs",
    "minmode",
    "streamer-mode",
    "materials",
    "customization"
  ],
  "traits": {
    "os": [
      "windows",
      "linux"
    ],
    "gamemode": [
      "tournament",
      "comp",
      "arena",
      "ad",
      "ctf",
      "cp",
      "halloween",
      "koth",
      "mannpower",
      "mvm",
      "pass",
      "pl",
      "plr",
      "pd",
      "rd",
      "sd",
      "tc"
    ],
    "res": [
      "16/9"
    ],
    "position": [
      "center"
    ],
    "lang": [
      "en"
    ]
  },
  "repo": "https://github.com/Hypnootize/hexhud",
  "hash": "572938c72e2b42b25de83ef5fbdb1ef3155d8c2c",
  "resources": [
    "hexhud-banner",
    "hexhud-menu",
    "hexhud-backpack",
    "hexhud-buff",
    "hexhud-low",
    "hexhud-minmode",
    "hexhud-medic",
    "hexhud-win",
    "hexhud-scoreboard",
    "hexhud-spectator"
  ]
}
