{
  "name": "SunsetHUD",
  "author": "Hypnotize",
  "verified": true,
  "social": {
    "steam_profile": "76561198058754493",
    "album": "https://imgur.com/a/cJYtauq"
  },
  "flags": [
    "fonts",
    "menus",
    "scoreboards",
    "crosshairs",
    "minmode",
    "streamer-mode",
    "materials",
    "customization"
  ],
  "traits": {
    "os": [
      "windows",
      "linux"
    ],
    "gamemode": [
      "tournament",
      "comp",
      "arena",
      "ad",
      "ctf",
      "cp",
      "halloween",
      "koth",
      "mannpower",
      "mvm",
      "pass",
      "pl",
      "plr",
      "pd",
      "rd",
      "sd",
      "tc"
    ],
    "res": [
      "4/3",
      "5/4",
      "16/9",
      "16/10"
    ],
    "position": [
      "center"
    ],
    "lang": [
      "en"
    ]
  },
  "repo": "https://github.com/Hypnootize/sunsethud",
  "hash": "fd4a3548f06580601f3fd2ffea5b378262cda068",
  "resources": [
    "sunsethud-banner",
    "sunsethud-menu",
    "sunsethud-backpack",
    "sunsethud-normal",
    "sunsethud-minmode",
    "sunsethud-medic",
    "sunsethud-engineer",
    "sunsethud-scoreboard",
    "sunsethud-spectator"
  ]
}
