{
  "name": "FlawHUD",
  "author": "CriticalFlaw",
  "verified": true,
  "social": {
    "steam_profile": "76561198041892999",
    "steam_group": "flawhud",
    "twitter": "CriticalFlaw_",
    "discord": "hTdtK9vBhE",
    "album": "https://imgur.com/a/0whDjXr"
  },
  "flags": [
    "customization",
    "crosshairs",
    "streamer-mode"
  ],
  "traits": {
    "os": [
      "windows",
      "mac",
      "linux"
    ],
    "gamemode": [
      "tournament",
      "comp",
      "arena",
      "ad",
      "ctf",
      "cp",
      "halloween",
      "koth",
      "mannpower",
      "mvm",
      "pass",
      "pl",
      "plr",
      "pd",
      "rd",
      "sd",
      "tc"
    ],
    "res": [
      "4/3",
      "16/9",
      "16/10"
    ]
  },
  "repo": "https://github.com/CriticalFlaw/flawhud",
  "hash": "a7e12d5360b783c6cff9783489625f3b84217310",
  "resources": [
    "banner",
    "hud",
    "scoreboard",
    "spectator",
    "menu",
    "loadout"
  ]
}
