{
  "name": "m0re techno",
  "author": "techno",
  "social": {
    "steam_profile": "76561198172101254"
  },
  "flags": [
    "fonts",
    "menus",
    "scoreboards",
    "crosshairs",
    "minmode",
    "materials",
    "customization"
  ],
  "traits": {
    "os": [
      "windows",
      "linux"
    ],
    "gamemode": [
      "tournament",
      "comp",
      "arena",
      "ad",
      "ctf",
      "cp",
      "halloween",
      "koth",
      "mannpower",
      "mvm",
      "pass",
      "pl",
      "plr",
      "pd",
      "rd",
      "sd",
      "tc"
    ],
    "res": [
      "4/3",
      "5/4",
      "16/9",
      "16/10"
    ],
    "position": [
      "center"
    ],
    "lang": [
      "en"
    ]
  },
  "repo": "https://github.com/TechnoSL/m0re_techno",
  "hash": "93755e09e846289f66363434bcfe87429dd71425",
  "parent": "m0rehud",
  "resources": [
    "m0re-techno-banner",
    "m0re-techno-gameplay"
  ]
}
